{
"RequestId": 654567891111434,
  "Operation": "Create",
  "Type": "MergeCustomerSite",
  "Data": {
    "CustomerAccountId": "300000003880357",
    "CustomerAccountSite": {
      "PartySiteId": "300000003880353",
      "CreatedByModule": "SIS",
      "SetId": "300000000003311",
      "CustomerAccountSiteUse": {
        "SiteUseCode": "BILL_TO",
        "LocationId": "300000003880350",
        "CreatedByModule": "SIS",
        "SetId": "300000000003311"
      }
    },
		"Dimension": [
			{
				"Customer_Site": "Mg028",
				"Customer_Site_Name": "TEST003_NAME",
				"Contract_number": "MgCO028",
				"Contract_Name": "CONT003_NAME",
				"Branch": "40009",
				"State": "029",
				"Entity": "999"
			}
		]

  }
}